{
  "$schema": "../approval-policy-v1.json",
  "policy_id": "policy-root-key",
  "version": "1.0.0",
  "name": "Root Key Operations",
  "description": "Maximum security policy for root/CA key operations (4-of-5 quorum)",
  "key_class": "root",
  "approval_requirements": {
    "min_approvers": 4,
    "total_pool": 5,
    "quorum_type": "n_of_m"
  },
  "timeouts": {
    "approval_hours": 72,
    "execution_hours": 4
  },
  "constraints": {
    "require_different_teams": true,
    "require_different_orgs": true,
    "require_senior_approver": true,
    "blocked_hours": [
      { "day": "Saturday", "start_hour": 0, "end_hour": 24 },
      { "day": "Sunday", "start_hour": 0, "end_hour": 24 },
      { "day": "*", "start_hour": 22, "end_hour": 6 }
    ]
  },
  "scope": {
    "org_id": null,
    "team_id": null
  },
  "enabled": true,
  "metadata": {
    "created_at": "2026-02-02T00:00:00Z",
    "created_by": "system",
    "approved_at": "2026-02-02T00:00:00Z",
    "approved_by": "security_council",
    "effective_date": "2026-02-02",
    "review_date": "2026-08-02",
    "deprecated": false,
    "superseded_by": null
  }
}
